{"schema":"nrm.customer.network_plan_result.v1","messageId":"plan-001","timestamp":"2026-08-13T10:00:01+08:00","source":"NRM","data":{"planId":"four-network-demo","revision":1,"validationPassed":true,"evaluationStatus":"FAIL","state":"REJECTED","reasonCodes":["PDR_NOT_MET"],"recommendations":["改用PDR更高的备用链路或质量更好的中继路径。"]}}
